id,name,address,rating,review_count
30302,Al-Nabares Palace Apart Hotel,"بجوار كوبري المربع, Al-Madinah Al-Munawarah Rd, Al Faisaliyah, Jeddah 23442, Saudi Arabia",3.5,2031
30303,Platinum Suites,"Alsahafah District, Prince Majid Road, 23342 Yeda, Arabia Saudí",4.2,1968
30304,Durat Al Matar Apartment,"Al-Nuzhah, Jeddah 23534, Saudi Arabia",3.4,1151
30305,Albilad Jeddah,"Al-Corniche Highway, Ash Shati, Jeddah 23512 21452, Saudi Arabia",3.8,2469
30306,Dara Quraish,"Quraysh Street, P.O.Box 40681, Al Salamah, Jeddah, JED, Saudi Arabia",4.1,997
30307,Loren Suites,"Sari Street, Abdul Rauf Jamjum, As Salamah, Jeddah 23436, Saudi Arabia",3.8,800
30308,Spectrums Tahlia Jeddah,"Prince Mohammed Bin Abdulaziz St, Al Andalus, Jeddah 23326 02146, Saudi Arabia",4.1,1020
30309,Odst Jeddah Hotel,"Al-Baghdadiyah Al-Sharqiyah, Jeddah 22235, Saudi Arabia",3.9,392
30310,Amjad Royal Suites Hotel,"Al-Madinah Al-Munawarah Road P.O Box 11718, Al Rawda, 21463, Yeda, Saudi Arabia",4.0,1099
30311,Quiet Dreams - King Road Branch,"Al Murjan District, King Abdulaziz Road, Al Murjan, Jeddah 23715, Saudi Arabia",3.9,448
30312,Tobal Jeddah Hotel Apartments,"Ahmad Al Attas, Al-Zahra'a, Jeddah 23425, Saudi Arabia",4.1,764
30313,Dorrat Alnaeem,"Amnah Bint Wahb Street. Al Naeem District, Amna Bint Wahb St, An Naim, Jeddah 23621, Saudi Arabia",3.7,537
30314,Orans Suites 4,"3398 Hilmi Kutbi, Al-Zahra'a, Jeddah 23521-6187, Saudi Arabia",3.9,63
30315,Layali Altamayoz 6,"Al Majma, Al Bawadi, Jeddah 23531, Saudi Arabia",3.6,547
30316,Mövenpick Hotel City Star Jeddah,"Madinah Road, 21512,  Jeddah, Saudi Arabia",4.6,9199
30317,Orans Suites 2,"Al Salamah District opposite International Thamer School, An Naim, Jeddah 23526 99999, Saudi Arabia",3.8,184
30318,AlHyatt Jeddah Continental Hotel,"Intersection of Sitteen St and Palastine St. Opposite of SAMBA Bank, 21471, Jeddah, Saudi Arabia",3.7,3
30319,Red Sea Palace Hotel,"King Abdul-Aziz Str.Beside The National C. Bank M.، Al-Baghdadiyah Al-Gharbiyah, Jeddah 22233, Saudi Arabia",4.0,4030
30320,Al Nabaress Al Macy Hotel,"Abdullah Sulayman St, Al-Fayha'a, Jeddah 22246, Saudi Arabia",4.7,1121
30321,Al Muhaidb Al Hamra,"Andalus Street, Jeddah, Saudi Arabia",3.9,798
30322,Issham Hotel,"Corniche Road, Al Shaty, Jeddah 23411, Saudi Arabia",3.6,917
30323,Rosewood Jeddah,"Corniche Street, P.O. Box 11097, Al Shatie District, Jeddah, 21453, Saudi Arabia",4.5,10449
30324,Rawaa Grand Hotel,"7276 King Fahd Branch Rd, Mishrifah, Jeddah 23332, Saudi Arabia",2.7,329
30325,Sadeem Furnished Apartments,"Alsalamah District , Al Yamamah Street، As Salamah, Jeddah 23436 21372, Saudi Arabia",3.6,248
432939,OYO 242 Al Ahlam Resort Al Leith,"ahlam, Al Firdous, Al Lieth, Jeddah, Saudi Arabia",3.8,4
442739,Arqa Almasaken,"Tibah Street, Algharbya District, 12345, Jeddah, Saudi Arabia",3.7,45
442740,Jeddah Park Hotel,"Essa Aladawy St. from Hail St., 23218, Jeddah, Saudi Arabia",3.9,373
442741,Al Azhar Hotel Jeddah Hotel,"Madina Road, Al-Baghdadiyah Al-Gharbiyah, Jeddah 22235 Al Baghdadya District, Saudi Arabia",4.2,554
442742,Madina Palace Hotel,"Alandalus Road, Albagdadia District, 21493, Jeddah, Saudi Arabia",3.6,2057
442743,Al Andalus Tolen hotel,"Abqiq, Al-Baghdadiyah Al-Gharbiyah, Jeddah 22231, Saudi Arabia",3.9,1749
948577,Al Akhawain Furnished Units,"Prince Mutaib Bin Abdulaziz Road, Jeddah, Saudi Arabia",3.8,159
949060,Arac Almarwa Hotel Apartments,"Abo Qtada, Jeddah 23545Makkah, Jeddah, 23545, Saudi Arabia",3.9,281
949061,Farha International for Furnished units,Al-Hamdanyah  13556 Jeddah  SA,4.3,32
949062,Iwan Alandalusia Al Safa,"7880 Ring Road, Al Safa District, As Safa District, 5108, 23454",3.7,403
1408121,AL MAHMAL HOTEL,"Falastin, Bani Malik, Jeddah 23232, Saudi Arabia",4.2,21473
1408621,Celine Al Motamaiza Furnished Apartment ,"Khalil Bik Al Ajjan, Cornish, Jeddah, Arabia Saudí, 23522 ",4.0,42
